[{"claim_id":"C-BRIER","claim":"Brier 0.211/0.214 on 2022–2024","status":"withdrawn","reason":"No script with saved output reproduces it; 0.2115 hardcoded","evidence_path":"reports/2026-09-28/AUDIT.md (M7)"},{"claim_id":"C-GAMES","claim":"2,282 games 2022–2024","status":"withdrawn","reason":"2022–2024 has ≈855 games","evidence_path":"reports/2026-09-28/AUDIT.md (M7)"},{"claim_id":"C-ACC","claim":"67.1% accuracy","status":"withdrawn","reason":"Hardcoded, cites nonexistent RESULTS.md","evidence_path":"reports/2026-09-28/AUDIT.md (M7)"},{"claim_id":"C-SPLINE","claim":"Spline calibration −6.9% Brier","status":"withdrawn","reason":"Calibrator trained on outcome-leaked probabilities","evidence_path":"reports/2026-09-28/AUDIT.md (M4)"},{"claim_id":"C-RANK","claim":"\"#2 vs professional models\", 538 0.215 / FPI 0.218","status":"withdrawn","reason":"Mock benchmark data","evidence_path":"reports/2026-09-28/AUDIT.md (M7)"},{"claim_id":"C-CORR","claim":"Prop correlations r=0.75/0.60/0.50/0.40 \"empirically validated\" with CIs","status":"withdrawn","reason":"Config uses 0.40/0.09/0.30/0.17; no saved analysis","evidence_path":"reports/2026-09-28/AUDIT.md (D1)"},{"claim_id":"C-PROD","claim":"Model status \"production-ready\"","status":"withdrawn","reason":"No backtest has passed the promotion gates; status is \"unvalidated research model\"","evidence_path":"reports/2026-09-28/AUDIT.md (D1)"},{"claim_id":"C-ADJ","claim":"Injury, weather and other adjustments \"statistically validated\" / \"validated with p < 0.05\"","status":"withdrawn","reason":"No saved test output reproduces the p-values; adjustments are config values","evidence_path":"reports/2026-09-28/AUDIT.md (D1)"},{"claim_id":"C-POSW","claim":"Position injury weights \"validated p < 0.001\"","status":"unvalidated","reason":"No saved test output found; re-test in Phase 3","evidence_path":"reports/2026-09-28/AUDIT.md (M7)"},{"claim_id":"C-SHRINK","claim":"\"60%\" / \"70%\" market shrinkage","status":"unvalidated","reason":"Effective weight ≈65.5% via two stages plus anti-shrink (M2, M3); fixed in Phase 1. For the Elo+EPA ensemble, Tune selects a 95% market weight (BT-V1-B2W); the simulator is judged in nfl_games_v2","evidence_path":"reports/2026-09-28/AUDIT.md (M2, M3)"},{"claim_id":"PROP_GAME_CORR_PASSING","claim":"0.40","status":"unvalidated","reason":"Config value; to be estimated point-in-time in Phase 4","evidence_path":"config.R"},{"claim_id":"PROP_GAME_CORR_RUSHING","claim":"0.09","status":"unvalidated","reason":"as above","evidence_path":"config.R"},{"claim_id":"PROP_GAME_CORR_RECEIVING","claim":"0.30","status":"unvalidated","reason":"as above","evidence_path":"config.R"},{"claim_id":"PROP_GAME_CORR_TD","claim":"0.17","status":"unvalidated","reason":"as above","evidence_path":"config.R"},{"claim_id":"BT-V1-BRIER","claim":"No game candidate (Elo, EPA GLM, their ensemble, market blends, calibrated ensemble) beats the no-vig closing moneyline on Brier, Confirm 2023–2024, 570 games","status":"reproducible","reason":"Negative result of the pre-registered walk-forward backtest nfl_games_v1; all controls passed; result_sha256 7244a0bc…","evidence_path":"reports/2026-09-29/backtest-games-v1/RESULT.md"},{"claim_id":"BT-V1-C0","claim":"No-vig closing moneyline: Brier 0.2098, log loss 0.6081 on 2023–2024 (570 non-tie games)","status":"reproducible","reason":"Benchmark C0 in nfl_games_v1","evidence_path":"reports/2026-09-29/backtest-games-v1/metrics.json"},{"claim_id":"BT-V1-B2W","claim":"Fixed-weight shrink of the Elo+EPA ensemble toward the close selects a 0.95 market weight (top of the 0.50–0.95 grid)","status":"reproducible","reason":"Tune 2018–2022 log loss falls monotonically as the model weight falls","evidence_path":"reports/2026-09-29/backtest-games-v1/metrics.json"},{"claim_id":"BT-V1-CLV","claim":"EPA GLM picks at the ESPN BET opener: mean CLV +93 bps, 95% CI +40 to +149 (2024, 214 picks)","status":"unvalidated","reason":"Descriptive only: below the 400-pick single-look gate (A2), one season, four candidates examined, flat ROI −7%; candidate for a single pre-registered prospective hypothesis","evidence_path":"reports/2026-09-29/backtest-games-v1/RESULT.md"}]
